,ques,answer
128,should i intimate my pan to deductor i.e. person deducting tax?,"Yes, you should intimate your PAN to the deductor i.e. person deducting tax. From 1st April, 2010, non-furnishing of PAN to deductors results in TDS at much higher rate of 20% or even more."
129,what is considered as salary income?,"section 17 of the Income-tax Act defines the term salary. However, not going into the technical definition, generally whatever is received by an employee from an employer in cash, kind or as a facility [perquisite] is considered as salary."
130,how will the new tan be intimated to the deductor?,NSDL will ensure intimation of new TAN at the address indicated in the Form 49B
131,how pan is formed and how it gets its unique identity?,"PAN is a ten-digit unique alphanumeric number issued by the Income Tax Department. The formation of PAN is discussed below :Out of the first five characters, the first three characters represent the alphabetic series running from AAA to ZZZ. (E.g.ALWPG5809L).The fourth character of PAN represents the status of the PAN holder (E.g.ALWPG5809L). ""A"" stands for Association of Persons (AOP)""A"" stands for Association of Persons (AoP)""B"" stands for Body of Individuals (BOI)""C"" stands for Company""E"" stands for Limited Liability Partnership""F"" stands for Firm""G"" stands for Government Agency""H"" stands for Hindu Undivided Family (HUF)""J"" stands for Artificial Juridical Person""L"" stands for Local Authority""P"" stands for Individual""T"" stands for TrustFifth character of PAN represents the first character of the PAN holder's last name/surname in case of an individual. In case of non-individual PAN holders fifth character represents the first character of PAN holder's name (E.g.ALWPG5809L)Next four characters are sequential numbers running from 0001 to 9999 (E.g.ALWPG5809L).Last character,i.e., the tenth character is an alphabetic check digit (E.g.ALWPG5809L).The combination of all the above items gives the PAN its unique identity."
132,"how can i open the pdf for intimation u/s 143(1) or rectification order u/s154 pdf, which is password protected?","The password is a combination of PAN (in lower case) and DOB in ddmmyyyy format for e.g. for PAN : bcmps1106b and dob : 02/10/1980, the password should be entered as bcmps1106b02101980."
133,what is the difference between e-filing and e-payment?,"E-payment is the process of electronic payment of tax (i.e., by net banking or SBIs debit/credit card) and e-filing is the process of electronically furnishing of return of income. Using the e-payment and e-filing facility, the taxpayer can discharge his obligations of payment of tax and furnishing of return easily and quickly."
134,"if a person is required by or under any other law to get his accounts audited, then is it compulsory for him to once again get his accounts audited to comply with the requirement of section 44ab?","Persons like company or co-operative society are required to get their accounts audited under their respective law.Section 44ABprovides that, if a person is required by or under any other law to get his accounts audited, then he need not again get his accounts audited to comply with the requirement ofsection 44AB. Is such a case, it shall be sufficient if such person gets the accounts of such business or profession audited under such law and obtains the report of the audit as required under such other law and also a report by the chartered accountant in the form prescribed undersection 44AB, i.e., Form No. 3CA and Form 3CD (refer to next FAQ for relevance of these forms)."
135,"error code 3:""part a, p and l and/or part a bs (balance sheet) have not been filled""","In case, if there are only pre-operative expenses, even then those expenses should be entered in P&L account. Then, assessee is also required to add back such expenses in serial no. 22 of schedule BP (i.e. ""Any other item or items of addition under section 28 to 44AD"") in the new xml which will be filed in response to this communication.Please ensure that Profit & Loss and Balance Sheet to be filled in case of both Indian and Foreign Company."
136,"while registering my dsc, an error appears on the screen as ""invalid digital signature certificate. please contact your certificate provider"". what should i do?","This could be due to the below reasons:1. Digital Signature Certificate is revoked.2. Digital Signature Certificate is not Level 2 or above. Only Level 2 or above Digital Certificates can be registered on e-Filing website.In this case, you should contact the Certificate Provider and get your Digital Signature Certificate checked."
137,can more than one itr-v be sent to cpc in one envelope?,"Yes, any number of ITR-Vs can be sent in one envelope. Caution has to be maintained that the bar code printed in the ITR-V does not get folded."
138,"am i liable for any criminal prosecution [arrest/imprisonment, etc.] if i dont file my income-tax return, even though my income is taxable?","Non-payment of tax attracts interests, penalty and prosecution. The prosecution can lead to rigorous imprisonment from 3 months to 2 years (when the tax sought to be evaded exceeds Rs. 25,00,000 the punishment could be 6 months to 7 years)."
139,what will be the tax implications if a person occupies more than one property for his residence? can he treat all the properties as self occupied (sop) and claim gross annual value (gav) as nil?,"The SOP benefit (i.e.,treating property as SOP and claiming GAV as Nil) is available only in respect of one property occupied by the owner for his residence.If a person occupies more than one property for his residence, then the SOP benefit will be granted only in respect of any one property as selected by him and other property/properties will be treated as ""Deemed to be let-out"". Income from deemed to be let-out property is computed in the same manner as discussed in the case of ""Let-out"" Property."
140,"what is the meaning of unabsorbed depreciation, unabsorbed capital expenditure on scientific research and unabsorbed capital expenditure on promoting family planning amongst the employees?","Apart from several other deductions, while computing income chargeable to tax under the head ""Profits and gains of business or profession"" a person is allowed to claim deduction on account for depreciation, capital expenditure incurred by him on scientific research and capital expenditure incurred by a company for promoting family planning amongst its employees.If the income of the year in which these expenses are incurred falls short of these expenses, then the unabsorbed expenses can be carried forward to next year in the form of unabsorbed depreciation or unabsorbed capital expenditure on scientific research or unabsorbed capital expenditure on promoting family planning amongst the employees. Consider the following illustration for better understanding.IllustrationBusiness income (computed as per the provisions of Income-tax Law) of Mr. Kiran before allowing deduction on account of depreciation amounted to Rs. 84,000. Depreciation as per the provisions ofsection 32amounted to Rs. 1,00,000. What will be the amount of unabsorbed depreciation in this case?**It can be observed that business income before claiming deduction undersection 32on account of depreciation is Rs. 84,000 and depreciation allowable as persection 32 is Rs. 1,00,000, hence, after claiming deduction on account of depreciation of Rs. 1,00,000, there will be a loss of Rs. 16,000. This loss is on account of depreciation and, hence, loss of Rs 16,000 will be termed as unabsorbed depreciation."
141,apart from marriage are there any other occasions in which monetary gift received by an individual will not be charged to tax?,"Gift received only on the occasion of marriage of the individual is not charged to tax. Apart from marriage there is no other occasion in which gift received by an individual is not charged to tax. Hence, gift received on occasions like birthday, anniversary, etc. will be charged to tax."
142,"'validate', 'calculate tax', 'generate' buttons are not working in return preparation software provided by the department.","Macros should be enabled in the Return Preparation Software. Below are the steps to enable Macros: 1. For Excel 2003 users: Click on TOOLS menu and select OPTIONS SECURITY Macro Security must be set to Medium or Low. 2. For Excel 2007 and Excel 2010 users: Click on the OFFICE button on the top left corner of the application and click EXCEL OPTIONS TRUST CENTER Trust Center Settings button Select Macro Settings and click on radio button ""Enable All Macros""."
143,what is the meaning of the term short-term capital asset?,"Any capital asset held by a person for a period of not more than 36 months immediately preceding the date of its transfer will be a short-term capital asset.However, in respect of certain assets like shares (equity or preference) which are listed in a recognised stock exchange in India, units of equity oriented mutual funds, listed securities like debentures and Government securities, Units of UTI and Zero Coupon Bonds, the period of holding to be considered is 12 months instead of 36 months.In case of unlisted shares in a company, the period of holding to be considered is 24 months instead of 36 months.IllustrationMr. Raj is a salaried employee. On 8thApril, 2014, he purchased a piece of land and sold the same on 29thJune, 2016. In this case, land is a capital asset for Mr. Raj. He purchased the land on 8thApril, 2014 and sold it on 29thJune, 2016,i.e.,after holding it for a period of less than 36 months. Hence, land will be a short-term capital asset.IllustrationMr. Kumar is a salaried employee. On 8th July, 2015, he purchased shares of SBI Ltd. (listed in BSE) and sold the same on 29thJune, 2016. In this case, shares are capital assets for Mr. Kumar. He purchased shares on 8th July, 2015 and sold them on 29thJune, 2016,i.e.,after holding them for a period of less than 12 months. Hence, shares are short-term capital assets."
144,do any clubbing provisions exist in case of a revocable transfer?,"Revocable transfer is generally a transfer in which the transferor directly or indirectly exercises control/right over the asset transferred or over the income from the asset.As persection 61, if a transfer is held to be a revocable, then income from the asset covered under revocable transfer is taxed in the hands of the transferor. The provisions ofsection 61will not apply in case of a transfer by way of trust which is not revocable during the life time of the beneficiary or a transfer which is not revocable during the lifetime of the transferee."
145,how can i reject an income tax form filed by a chartered accountant on my behalf?,"LOGIN using your credentials and GO TO Work-list. Select the Income Tax Form you wish to reject, provide comments and click on the Reject button."
146,what are the precautions that i should take while filling-up the tax payment challan?,"While making payment of tax, apart from other things, one should clearly mention following :Head of payment,i.e., Corporation Tax/Income-tax (other than companies)Amount and mode of payment of tax Type of payment [i.e.,Advance tax/Self assessment tax/Tax on regular assessment/Tax on Dividend/Tax on distributed Income to Unit holders/Surtax] Assessment yearThe unique identification number called as PAN [Permanent Account Number] allotted by the IT Department."
147,what is assessment under section 144?,Assessment undersection 144 (called best judgment assessment) is an assessment carried out as per the best judgment of the Assessing Officer. Best judgment assessment is resorted due to certain failures (specified under section 144) on the part of the taxpayer (discussed in next FAQ).
148,"i am assigned as a legal heir for a deceased person. while uploading the income tax return of the deceased, i am getting an error ""pan mentioned on personal information is invalid"". what do i do?","Please ensure that the PAN entered in the Verification section of the Income Tax Return is your (Legal heir) PAN and not of the deceased person. Also, if the Income Tax Return is being digitally signed, the PAN encrypted in the DSC must match with the PAN mentioned in the verification section."
149,"if a person adopts the presumptive taxation scheme of section 44ada, then is he liable to pay advance tax in respect of income from profession covered under section 44ada?",A person opting for the presumptive taxation scheme ofsections 44ADA is also liable to pay advance tax.
150,will i be put to any disadvantage by filing my return?,"No, on the contrary by not filing your return inspite of having taxable income, you will be liable to the penalty and prosecution provisions under the Income-tax Act."
151,what is the time limit for making the assessment under section 144 i.e. best judgment assessment?,"As persection 153, assessment undersection 144shall be made within a period of 21 months from end of the assessment year in which income was first assessable. [Inserted by the Finance Act, 2016 w.e.f. 1-6-2016]Note: If reference is made to TPO, the period available for assessment shall be extended by 12 months"
152,can an income tax return e-filed with one itr form say itr-2 be rectified in any other itr form?,No.
153,is my responsibility under the income-tax act over once taxes are paid?,"No, you are thereafter responsible for ensuring that the tax credits are available in your tax credit statement and TDS/TCS certificates received by you and that full particulars of income and tax payment are submitted to the Income-tax Department in the form of Return of Income which is to be filed before the due date prescribed in this regard."
154,how to determine the residential status of an individual?,"To determine the residential status of an individual, the first step is to ascertain whether he is resident or non-resident. If he turns to be a resident, then the next step is to ascertain whether he is resident and ordinarily resident or is a resident but not ordinarily resident.Step 1 given below will ascertain whether the individual is resident or non-resident and step 2 will ascertain whether he is ordinarily resident or not ordinarily resident. Step 2 is to be performed only if the individual turns to be a resident.Step 1: Determining whether resident or non-residentUnder the Income-tax Law, an individual will be treated as a resident in India for a year if he satisfies any of the following conditions (i.e.may satisfy any one or may satisfy both the conditions):(1) He is in India for a period of 182 days or more in that year; or(2) He is in India for a period of 60 days or more in the year and for a period of 365 days or more in 4 years immediately preceding the relevant year.If an individual does not satisfy any of the above conditions he will be treated as non-resident in India.Note :Condition given in (2) above will not apply to an Indian citizen leaving India for the purpose of employment or to an Indian citizen leaving India as a member of crew of Indian ship or to an Indian citizen/person of Indian origin coming on a visit to India. A person is said to be of Indian origin, if he or any of his parents or grand-parents (maternal or paternal) were born inundividedIndia.Note: With effect from Assessment Year 2015-16, in the case of an individual, being a citizen of India and a member of the crew of a foreign bound ship leaving India, theperiod or periods of stay in India shall, in respect of such voyage, be determined in the manner and subject to such conditions as may be prescribed.Step 2: Determining whether resident and ordinarily resident or resident but not ordinarily residentA resident individual will be treated as resident and ordinarily resident in India during the year if he satisfies following conditions:(1) He is resident in India for at least 2 years out of 10 years immediately preceding the relevant year.(2) His stay in India is for 730 days or more during 7 years immediately preceding the relevant year.A resident individual who does not satisfy any of the aforesaid conditions or satisfies only one of the aforesaid conditions will be treated as resident but not ordinarily resident.In short, following test will determine the residential status of an individual:If the individual satisfy any one or both the conditions specified at step 1 and satisfies both the conditions specified at step 2, then he will become resident and ordinarily resident in India.If the individual satisfy any one or both the conditions specified at step 1 and satisfies none or one condition specified at step 2, then he will become resident but not ordinarily resident in India.If the individual satisfy no conditions satisfied at step one, then he will become non-resident."
155,can a legal heir e-file the income tax return of the deceased assessee?,"Yes. A Legal Heir can file Income Tax Return, View Status of Income Tax Return, ITR-V Acknowledgment and other filing status in respect of the Income Tax Return of the deceased person for the e-Filed Assessment Year."
156,are there any special provisions in case of carry forward and set off of loss in case of a company in which public are not substantially interested?,"As persection 79of the Income-tax Act, where a change in shareholding has taken place in a previous year in the case of a company, not being a company in which the public are substantially interested, no loss incurred in any year prior to the previous year shall be carried forward and set off against the income of the previous year unless-On the last day of the previous year the shares of the company carrying not less than fifty-one per cent of the voting power were beneficially held by person who beneficially held shares of the company carrying not less than fifty-one per cent of the voting power on the last day of theyear or years in which the loss was incurred.Restriction ofsection 79is applicable only in case of loss and is not applicable in case of adjustment of unabsorbed depreciation, unabsorbed capital expenditure on scientific research or family planning expenditure.Further, the provisions ofsection 79 are not applicable in case of change in share holding on account of death of shareholder or on account of transfer of shares by way of gift to any relative of the shareholder or change in shareholding in case of an Indian company which is a subsidiary of foreign company, when such foreign company is amalgamated/demerged with another foreign company and 51% or more shareholders of the amalgamating/demerged foreign company continues to be the shareholders of the amalgamated/resulting foreign company."
157,what are the benefits of obtaining a permanent account number [pan] and pan card?,"A Permanent Account Number has been made compulsory for every transaction with the Income-tax Department. It is also mandatory for numerous other financial transactions such as opening of bank accounts, in bank account, deposit of cash in bank account, opening of Demat account, transaction of immovable properties, dealing in securities, etc. A PAN card is a valuable means of photo identification accepted by all Government and non-Government institutions in the country."
158,is family pension taxed as salary income?,"No, it is taxable as income from other sources."
159,what is a return of income?,It is a prescribed form through which the particulars of income earned by a person in a financial year and taxes paid on such income are communicated to the Income-tax Department. Different forms of returns of income are prescribed for filing of returns for different Status and Nature of income. These forms can be downloaded from www.incometaxindia.gov.in
160,what is exempt income and taxable income?,"An exempt income is not charged to tax,i.e.,Income-tax Law specifically grants exemption from tax to such income. Incomes which are chargeable to tax are called as taxable incomes.E.g.,Dividend income from an Indian company is granted specific exemption and, hence, the same is not liable to tax in the hands of the shareholders. However, dividend from a foreign company is taxable."
161,what are the steps in brief to upload the income tax return on this website?,"Visit ITD e-filing websitehttps:\incometaxindiaefiling.gov.inOn homepage, GO TO 'Downloads' section and select applicable Income Tax Return Form of the relevant Assessment Year OR Login to e-Filing application and GO TO 'Downloads''Income Tax Return Forms' and select applicable Income Tax Return Form of the relevant Assessment Year.Download the excel utility of the Income Tax Return (ITR).Fill the excel utility and Validate.Generate an XML file and save in desired path/destination in your desktop/system.LOGIN to e-Filing application and GO TO e-File Upload Return.Select the Income Tax Return Form and the Assessment Year.Browse and Select the XML fileUpload Digital Signature Certificate, if available and applicable.Click 'SUBMIT'.On successful upload, Acknowledgement details would be displayed. Click the link to view or generate a printout of Acknowledgement/ITR-V Form."
162,when is a business connection said to be established?,"Business connection includes a profession at connection. Business connection includes any activity carried out through a person acting on behalf of a non-resident who performs any one or more of the following:If such person has in India authority to conclude contracts on behalf of the non-resident (it will not include cases where authority is restricted to contract for purchase of goods or merchandise on behalf such non-resident); orIf such person in India habitually maintains stock of goods or merchandise from which he regularly delivers goods or merchandise on behalf of the non-resident;If such person habitually secures orders in India mainly or wholly for the non-resident or for the other non-resident under the same management.No business connection shall be deemed to have been established, if the business is carried on through an independent broker, general commission agent or other agent (i.e.,a broker or commission agent who is not working mainly or wholly for such non-resident or other non-resident under same management), provided such person is working in his ordinary course of business.Only so much of income which accrues or arises due to such business connection is deemed to be income accruing or arising from India and not the entire income of the non-resident."
163,who can use itr  2?,"Return Form ITR - 2 can be used by an individual or a Hindu Undivided Family whose total income for the year includes:     Income from Salary / Pension; or     Income from House Property; or     Income from Capital Gains; or     Income from Other Sources (including winnings from lottery and income from race horses).Further, in a case where the income of another person like spouse, minor child, etc., is to be clubbed with the income of the taxpayer, this Return Form can be used if income to be clubbed falls in any of the above categories."
164,can a person who owns more than 10 goods vehicles adopt the presumptive taxation scheme of section 44ae?,"The presumptive taxation scheme of sections 44AEcan be adopted by a person who is engaged in the business of plying, hiring or leasinggoods carriages and who does not own more than 10 goods vehicles at any time during the year.The important criterion of the scheme is the restriction of owning of not more than 10 goods vehicles at any time during the year. Thus, if a person owns more than 10 goods vehicles at any time during the year, then he cannot take advantage of this scheme."
165,"can a person whose total turnover or gross receipts for the year exceed rs. 2,00,00,000 adopt the presumptive taxation scheme of section 44ad?","The presumptive taxation scheme ofsection 44ADcan be opted by the eligible persons if the total turnover or gross receipts from the business do not exceed the limit prescribed undersection 44AB (i.e.,Rs. 2,00,00,000). In other words, if the total turnover or gross receipt of the business exceeds Rs. 2,00,00,000 then the scheme ofsection 44ADcannot be adopted."
166,"what are the major provisions covered in fema, 1999?","The major provisions of FEMA, 1999 relate to following matters :Dealing in foreign exchange, etc.Holding of foreign exchange, etc.Current account transactionsCapital account transactionsExport of goods and servicesRealization and repatriation of foreign exchangeExemption from realization and repatriation in certain cases.Provisions relating to authorised persons.i.e.authorised by RBI to deal with foreign exchange or in foreign securitiesPower of RBI to inspect authorized personContravention and penaltiesAdjudication and appealDirectorate of enforcementMiscellaneous provisionsFor more details on FEMA refer to the FAQ section atwww.rbi.org.in"
167,how will i know how much income-tax i have to pay?,The rates of Income-tax and corporate taxes are available in the Finance Act passed by the Parliament every year. You can also check your tax liability by using the free online tax calculator available at www.incometaxindia.gov.in
168,assessee wants to know e-mail id for cpc?,"All queries to CPC will be handled at their Helpline Numbers- Toll free - 1800-425-2229, and Phone Number - 080-22546500"
