,ques,answer
235,who has to obtain pan?,"PAN is to be obtained by following persons:Every person if his total income or the total income of any other person in respect of which he is assessable during the previous year exceeds the maximum amount which is not chargeable to tax.A charitable trust who is required to furnish return underSection 139(4A)Every person who is carrying on any business or profession whose total sale, turnover, or gross receipts are or is likely to exceed five lakh rupees in any previous yearEvery importer/exporter who is required to obtain Import Export codeEvery person who is entitled to receive any sum/income after deduction of tax at sourceAny person who is liable to pay excise duty or a producer or manufacturer of excisable goods or a registered person of a private warehouse in which excisable goods are stored and an authorized agent of such personPersons who issue invoices under Rule 57AE requiring registration under Central Excise Rules, 1944A person who is liable to pay the service tax and his agentPersons registered under the Central Sales Tax Act or the general sales tax law of the relevant state or union territoryEvery person who intends to enter into specified financial transactions in which quoting of PAN is mandatoryA person not covered in any of the above can voluntarily apply for PAN."
236,is it mandatory to file return of income after getting pan?,No. The liability to file return of income is governed by different set of parameters laid down in the Income Tax Act 1961.
237,where and how am i supposed to file my return?,Return of income can be filed either in hard copy at the local office of the Income-tax Department or can be electronically filed at www.incometaxindiaefiling.gov.in In the case of certain persons (already discussed in previous FAQ) e-filing is mandatory.
238,"is there any special benefit available under the income-tax law to very high aged person, i.e., very senior citizens?","Yes, the Income-tax Law very well takes care of very senior citizens of the nation by offering special tax benefits to high aged person (80 year or above)."
239,how to deposit self assessment tax or advance tax to the credit of government??,"Self  Assessment Tax or Advance Tax is to be deposited to the credit of Government by using the challan prescribed in this behalf, i.e., ITNS 280. The Challan can be downloaded from www.incometaxindia.gov.in Tax can be paid in the designated banks through two modes, viz., physical mode, i.e., cash/cheque or e-payment mode."
240,what are the circumstances under which assessment under section 147 i.e. income escaping assessment can be carried out?,"In the following cases, it will be deemed that income chargeable to tax has escaped assessment:Where no return of income has been furnished by the taxpayer, although his total income or the total income of any other person in respect of which he is assessable during the year exceeded the maximum amount which is not chargeable to income-tax.Where a return of income has been furnished by the taxpayer but no assessment has been made and it is noticed by the Assessing Officer that the taxpayer has understated the income or has claimed excessive loss, deduction, allowance or relief in the return.Where the taxpayer has failed to furnish a report in respect of any international transaction which he was required to file undersection 92E.Where an assessment has been made, but:(i) income chargeable to tax has been under assessed; or(ii) income has been assessed at low rate; or(iii) income has been made the subject of excessive relief; or(iv) excessive loss or depreciation allowance or any other allowance has been computed;Where a person is found to have any asset (including financial interest in any entity) located outside India.Where a return of income has not been furnished by the assessee and on the basis of information or document received from the prescribed income-tax authority, undersection 133C(2), it is noticed by the Assessing Officer that the income of the assessee exceeds the maximum amount not chargeable to tax.Where a return of income has been furnished by the assessee and on the basis of information or document received from the prescribed income-tax authority, undersection 133C(2), it is noticed by the Assessing Officer that the assessee has understated the income or has claimed excessive loss, deduction, allowance or relief in the return."
241,can an insurance agent adopt the presumptive taxation scheme of section 44ad?,"A person who is earning income in the nature of commission or brokerage cannot adopt the presumptive taxation scheme ofsection 44D. Insurance agents earn income by way of commission and, hence, they cannot adopt the presumptive taxation scheme ofsection 44D."
242,what are the benefits of filing my return of income?,"Filing of return is your duty and earns for you the dignity of consciously contributing to the development of the nation. Apart from this, your income-tax returns validate your credit worthiness before financial institutions and make it possible for you to access many financial benefits such as bank credits, etc."
243,is there any tatkal facility for allotment of pan?,No
244,"while registering my dsc, an error appears on the screen as ""the digital signature certificate is already registered"". what should i do?","A DSC can not be registered by multiple users. When this error appears, it maybe that the DSC you are trying to register belongs to someone else. Please make sure that the DSC you are registering belongs to you and has your PAN and e-mail ID encrypted. The only exception for this rule is that an authorized signatory (principal contact) for an organization should register his/her own DSC to e-File for the organization. The same DSC can be used for personal e-Filing too."
245,how can i see the rectification status?,LOGIN and GO TO 'My Account' 'Rectification Status'.
246,under what circumstances the assessing officer will proceed for making assessment under section 144 i.e. best judgment assessment?,"As persection 144, the Assessing Officer is under an obligation to make an assessment to the best of his judgment in the following cases:If the taxpayer fails to file the return of income as required within the due date prescribed undersection 139(1)or a belated return undersection 139(4)or a revised return undersection 139(5).If the taxpayer fails to comply with all the terms of a notice issued undersection 142(1).Note:section 142(1)deals with the general provisions relating to an inquiry before assessment. Undersection 142(1), the Assessing Officer can issue notice asking the taxpayer to file the return of income if he has not filed the return of income or to produce or cause to be produced such accounts or documents as he may require and to furnish in writing and verified in the prescribed manner information in such form and on such points or matters (including a statement of all assets and liabilities of the taxpayer, whether included in the accounts or not) as he may require.If the taxpayer fails to comply with the directions issued undersection 142(2A).Note:Section 142(2A)deals with special audit. As persection 142(2A), if the conditions justifying special audit as given insection 142(2A)are satisfied, then the Assessing Officer will direct the taxpayer to get his accounts audited from a chartered accountant nominated by the principal chief commissioner or Chief Commissioner or Principal Commissioner or Commissioner and to furnish a report of such audit in the prescribed form.If after filing the return of income, the taxpayer fails to comply with all the terms of a notice issued undersection 142(2A),i.e., notice of scrutiny assessment.From the above criteria, it can be observed that best judgment assessment is resorted in cases where the return of income is not filed by the taxpayer or there is no co-operationby the taxpayer on various matters."
247,what do i need to do post uploading the income tax return?,"If the Income Tax Return is uploaded with DSC (digitally signed), on generation of ""Acknowledgement"" the Return Filing process is complete. The return will be further processed and the Assessee will be notified accordingly. Please check your emails on these notifications.If the return is not uploaded with a DSC (digitally signed), on successful upload of e-Return, an ITR-V Form will be generated. This is an Acknowledgement cum Verification form. A duly verified ITR-V form should be signed and submitted to CPC, Post Bag No.1, Electronic City Post office, Bangalore-560100 by Ordinary Post or Speed Post (without Acknowledgment) ONLY, within 120 days from the date of e-Filing. On receipt of the ITR-V at CPC, the return will be further processed and the Assessee will be notified accordingly. Please check your emails on these notifications."
248,what are form nos. 3ca/3cb and 3cd?,"The report of the tax audit conducted by the chartered accountant is to be furnished in the prescribed form. The form prescribed for audit report in respect of audit conducted undersection 44AB is Form No. 3CB and the prescribed particulars are to be reported in Form No. 3CD.In case of persons covered under previous FAQ,i.e.,who are required to get their accounts audited by or under any other law, the form prescribed for audit report is Form No. 3CA and the prescribed particulars are to be reported in Form No. 3CD."
249,"while computing income chargeable to tax under the head income from house property in the case of a let-out property, what are the expenses to be deducted from gross annual value?","While computing income chargeable to tax under the head ""Income from house property"" in the case of a let-out property, only following items can be claimed as deductions from gross annual value. It other words, deduction cannot be claimed for any expenditure incurred by the taxpayer other than following:Deduction on account of municipal taxes paid by the taxpayer during the year (*).Deduction undersection 24(a)@ 30% of Net Annual Value.Deduction undersection 24(b) on account of interest on capital borrowed for the purpose of purchase, construction, repair, renewal or reconstruction of the property.(*)Only municipal taxes paid by the owner during the year can be deduced, hence, municipal taxes due but not paid during the year cannot be deducted or taxes borne by the tenant cannot be deducted."
250,can income from assets transferred to spouse without adequate consideration be clubbed with the income of transferor-spouse?,"As persection 64(1)(iv), if an individual transfers (directly or indirectly) his/her asset (other than house property) to his or her spouse otherwise than for adequate consideration, then income from such asset will be clubbed with the income of the individual (i.e.,transferor). Income from transfer of house property without adequate consideration will also attract clubbing provisions, however, in such a case clubbing will be done as persection 27 and not undersection 64(1)(iv).  The clubbing provisions ofsection 64(1)(iv)will apply even if the form of asset is changed by the transferee-spouse. There are certain situations in which the  clubbing provisions ofsection 64(1)(iv)are not applicable (refer next FAQ for these situations).Illustration CMr. Soham holds 8,400 debentures of Shyamal Minerals Ltd. He gifted these debentures to his wife. Will the income from debentures be clubbed with the income of Mr. Soham?**In this situation, the debentures are transferred to spouse. Transfer is via gift (i.e.,without any consideration) and, hence, income generated from the transferred asset,i.e.,interest on such debentures will be clubbed with the income of Mr. Soham. Illustration DMr. Kapoor gifted Rs. 8,40,000 to his wife. The said amount is invested by his wife in debenture of a company. Will the income from the debenture purchased by Mrs. Kapoor from gifted money be clubbed with the income of Mr. Kapoor?**Rs. 8,40,000 is transferred to spouse. Fund is transferred via gift (i.e.,without adequate consideration) and, hence, the provisions ofsection 64(1)(iv)will be attracted. The provisions of clubbing will apply even if the form of asset is changed by the transferee-spouse.In this case asset transferred is money and, subsequently, the form of asset is changed to debentures, hence, income from debentures acquired from money gifted by her husband will be clubbed with the income of her husband. Thus, interest on debenture received by Mrs. Kapoor will be clubbed with the income of Mr. Kapoor."
251,who must apply for tan?,"Every person liable to deduct tax at source or collect tax at source is required to obtain TAN. However, a person required to deduct tax undersection 194IA(*) can use PAN in place of TAN as such person is not required to obtain TAN.(*)Section 194IAprovides for deduction of tax at source from payment on transfer of certain immovable property other than agricultural land."
252,"while uploading the income tax return, i am getting an error ""the xml schema is invalid. please upload the xml in the correct schema"". what does this error mean?","This error occurs when you might have tampered with the XML generated from the Return Preparation Software (Excel/Java utility). Ensure that you upload the XML as it is generated from the Return Preparation Software. Also, ensure that you have downloaded and generated the XML from the 'Return Preparation Software' of the relevant Assessment Year and relevant Form type. The same Assessment Year and Form type must be selected while uploading the Income Tax Return Form."
253,what are the forms of return prescribed under the income-tax law?,"Under the Income-tax Law, different forms of returns are prescribed for different classes of taxpayers. The return forms are known as ITR forms (Income Tax Return Forms). The forms of return prescribed under the Income-tax Law for filing of return of income for the assessment year 2016-17 (i.e., financial year 2015-16) are as follows: Return FormBrief DescriptionITR - 1Also known as SAHAJ is applicable to an individual having salary or pension income or income from one house property (not a case of brought forward loss) or income from other sources (not being lottery winnings and income from race horses).ITR 2AIt is applicable to an individual or HUF whose total income for the assessment year 2016-17 does not include income from business or profession, capital gains. Further, an individual or HUF claiming foreign tax credit or having any asset (including financial interest in any entity) located outside India or having any signing authority in any account located outside India or having income from any source outside India cannot use this form for filing of return of income.ITR - 2It is applicable to an individual or a Hindu Undivided Family having income from any source other than ""Profits and gains of business or profession"".ITR - 3It is applicable to an individual or a Hindu Undivided Family who is a partner in a firm and where income chargeable to tax under the head ""Profits or gains of business or profession"" does not include any income except the income by way of any interest, salary, bonus, commission or remuneration, by whatever name called, due to, or received by him from such firm.ITR - 4SAlso known as SUGAM is applicable to individuals or Hindu Undivided Family or partnership firm (other than limited liability partnership firm) who have opted for the presumptive taxation scheme of section 44AD/44AE.ITR - 4It is applicable to an individual or a Hindu Undivided Family who is carrying on a proprietary business or profession.ITR - 5This Form can be used by a person being a firm, LLP, AOP, BOI, artificial juridical person referred to in section 2(31)(vii), co-operative society and local authority. However, a person who is required to file the return of income under section 139(4A) or 139(4B) or 139(4C) or 139(4D) or section 139(4E) or section 139(4F) shall not use this form (i.e.,trusts, political parties, institutions, colleges, investment fund etc.)ITR - 6It is applicable to a company, other than a company claiming exemption under section 11 (exemption under section 11 can be claimed by charitable/religious trust).ITR - 7It is applicable to a persons including companies who are required to furnish return under section 139(4A) or section 139(4B) or section 139(4C) or section 139(4D) or section 139(4E) or section 139(4F) (i.e.,trusts, political parties, institutions, colleges, investment fund, etc.).ITR - VIt is the acknowledgement of filing the return of income."
254,what will be the status of audit report under section 44ab as now it is not required to be furnished along with the return of income?,"This issue has already been clarified by Circular no. 9 dated 10.10.2006 issued by CBDT. As clarified therein, the new annexure less forms are not to be attached with any documents."
255,income-tax is levied on the income of every person. as per income-tax law what constitutes income?,"Under the Income-tax Law, the word income has a very broad and inclusive meaning. In case of a salaried person all that is received from an employer in cash, kind or as a facility is considered as an income. For a businessman his net profit will constitute his income. Income may also flow from investments in the form of Interest, Dividend, Commission, etc. Further, income may be earned on account of sale of capital assets like building, gold, etc.Income shall be computed as per relevant provision of Income-tax Act, 1961 which lays down detail condition for computation of income chargeable to tax under various heads of income"
256,what is the period for which a persons income is taken into account for the purpose of income-tax?,"Income-tax is levied on the annual income of a person. The year under the Income-tax Law is the period starting from 1stApril and ending on 31stMarch of next calendar year. The Income-tax Law classifies the year as (1) Previous year, and (2) Assessment year.The year in which income is earned is called as previous year and the year in which the income is charged to tax is called as assessment year.e.g.,Income earned during the period of 1stApril, 2015 to 31stMarch, 2016 is treated as income of the previous year 2015-16. Income of the previous year 2015-16 will be charged to tax in the next year,i.e.,in the assessment year 2016-17."
257,who cannot use itr  6?,Form ITR  6 cannot be used by a company claiming exemption undersection 11 (charitable/religious trust can claim exemption undersection 11).
258,"error code 1:""tax computed but gti(gross total income) is nil or 0?""",Description:No tax can be computed without providing the details of income. The Assessee should maintain consistency in providing details of income and tax computation in the return of income in the new xml which will be filed in response to this communication.
259,are gifts of immovable property received by an individual or huf charged to tax?,"If the following conditions are satisfied then immovable property received by an individual or HUF will be charged to tax (*):Immovable property, being land or building or both, is received by an individual/HUF.The immovable property is received without consideration (i.e.,received as a gift) or for a consideration which is less than the stamp duty value of the property by an amount exceeding Rs.50,000.The immovable property is a 'capital asset' within the meaning ofsection 2(14) for such as individual or HUF.The stamp duty value of such immovable property received without consideration exceeds Rs. 50,000.(*) Refer next FAQ for situations in which immovable property received without consideration (i.e.,received as a gift) by an individual or HUF is not charged to tax."
260,what documents will serve as proof of identity in case of individuals not being a citizen of india?,"Copy of following will serve as proof of identity in case of individuals not being a citizen of India :Copy of passport, orCopy of Person of Indian Origin (PIO) card issued by Government of India, orCopy of Overseas Citizen of India (OCI) card issued by Government of India, orCopy of other national or citizenship Identification Number or Taxpayer Identification Number duly attested by ""Apostille"" (in respect of countries which are signatories to the Hague Apostille Convention of 1961) or by the Indian Embassy or High Commission or Consulate in the country where the applicant is located or authorised officials of overseas branches of Scheduled Banks registered in India."
261,what date should be provided in case 'ancestral date' is written on pan card?,Kindly enter the date as 01/01/0001
262,what is the tax treatment of arrears of rent?,The amount received on account of arrears of rent (not charged to tax earlier) will be charged to tax after deducting a sum equal to 30% of such arrears. It is charged to tax in the year in which it is received. Such amount is charged to tax whether or not the taxpayer owns the property in the year of receipt.
263,what is the due date for filing of statement of financial transaction or reportable account by prescribed reporting financial institution?,"In order to facilitate effective exchange of information in respect of resident and non-resident, Section 285BA also provides for furnishing of statement by a prescribed reporting financial institution in respect of specified financial transaction or reportable account. The statement shall be furnished for each calendar year in Form No. 61B on or before 31st May of the next year. [For more details, see rules 114F, 114G and 114H of the Income-tax Rules, 1962]"
264,why the house property loss is not populated in the part b-ti schedule of income tax return?,This situation occurs if only the Amount is filled in the HP schedule in Income Tax Return. You need to fill up the complete Address detail of the house property in the 'House Property' schedule along with the other details. While filling the detail please ensure that no special characters are entered in the respective fields.
265,how to compute income from self occupied property?,"A self-occupied property means a property which is occupied throughout the year by the taxpayer for his residence. Income chargeable to tax under the head ""Income from house property"" in case of a self-occupied property is computed in following manner :ParticularsAmountGross annual valueNilLess:-Municipal taxes paid during the yearNilNet Annual Value (NAV)NilLess:-Deduction undersection 24 Deduction undersection 24(a)@ 30% of NAVDeduction undersection 24(b)on account of interest on borrowed capitalNil (XXXX)Income from house propertyXXXX From the above computation it can be observed that ""Income from house property"" in the case of a self occupied property will be either Nil (if there is no interest on housing loan) or negative (i.e.,loss) to the extent of interest on housing loan. Deduction in respect of interest on housing loan in case of a self-occupied property cannot exceed Rs. 2,00,000 or Rs. 30,000, as the case may be (discussed later)."
266,"if a person adopts the presumptive taxation scheme of section 44ae, then is he required to maintain books of account as per section 44aa?","Section 44AAof the Income-tax Act, 1961 has provisions relating to maintenance of books of account by a person engaged in business/profession. Thus, a person engaged in business/profession has to maintain books of account of his business according to the provisions of section 44AA.In case of a person opting for the presumptive taxation scheme ofsection 44AE, the provisions of section 44AArelating to maintenance of books of account will not apply. In other words, if a person adopts the provisions ofsection 44AEand declares his income at the rate of Rs. 7,500 per goods vehicle per month, then he is not required to maintain the books of account as provided under section 44AAin respect of business covered under the presumptive taxation scheme ofsection 44AE."
267,what is cpc help line number?,"The helpline numbers for CPC are: Toll free - 1800-425-2229, and Phone Number - 080-22546500"
268,under which head is the rental income from a shop charged to tax?,"Rental income from a property, being building or land appurtenant thereto, of which the taxpayer is the owner is charged to tax under the head Income from house property. To tax the rental income under the head Income from house property, the rented property should be building or land appurtenant thereto. Shop being a building, rental income will be charged to tax under the head Income from house property."
269,who is eligible to take advantage of the presumptive taxation scheme of section 44ad?,"The presumptive taxation scheme ofsection 44ADcan be adopted by following persons :1) Resident Individual2) Resident Hindu Undivided Family3) Resident Partnership Firm (not Limited Liability Partnership Firm)In other words, the scheme cannot be adopted by a non-resident and by any person other than an individual, a HUF or a partnership firm (not Limited Liability Partnership Firm).Further, this Scheme cannot be adopted by a person who has made any claim towards deductions undersection 10A/10AA/10B/10BAor under sections 80HHto80RRBin the relevant year."
270,"if i fail to furnish my return within the due date, will i be fined or penalized?","Yes, if you have not furnished the return within the due date, you will have to pay interest on tax due. If the return is not filed up to the end of the assessment year, in addition to interest, a penalty of Rs. 5,000 shall be levied undersection 271F."
