,ques,answer
361,"what is the meaning of stamp duty value and what is its relevance while computing capital gain in case of transfer of capital asset, being land or building or both?","Stamp duty value means the value adopted or assessed or assessable by any authority of a State Government for the purpose of payment of stamp duty.As persection 50C, while computing capital gain arising on transfer of land or building or both, if the actual sale consideration of such land and/or building is less than the stamp duty value, then the stamp duty value will be taken as full value of consideration,i.e.,as deemed selling price and capital gain will be computed accordingly.IllustrationMr. Raja sold his bungalow for Rs. 80,00,000. The value adopted by the Stamp Valuation Authority of the bungalow for the purpose of payment of stamp duty is Rs. 84,00,000. In this situation, while computing taxable capital gain arising on transfer of bungalow, Rs. 84,00,000 will be taken as full value of consideration (i.e.,sale value of the bungalow). Thus, actual selling price of Rs. 80,00,000 (being less than stamp duty value) will not be taken into account while computing taxable capital gain.IllustrationMr. Karan sold his land for Rs. 25,20,000. The value adopted by the Stamp Valuation Authority of the bungalow for the purpose of payment of stamp duty is Rs. 20,00,000. In this situation, while computing taxable capital gain arising on transfer of land, Rs. 25,20,000 (being actual sale value) will be taken as full value of consideration. Thus, stamp duty value (being less than actual selling price) will not be taken into account while computing taxable capital gain.What is the tax treatment of Advance money forfeited under a un-materialized contract for transfer of capital Asset?Any advance received on transfer of capital asset shall be chargeable to tax under the head 'Income from other sources', if such sum is forfeited and the negotiations do not result in transfer of capital Asset."
362,what should i do if my tax payment particulars are not found against my name in the website?,The possible reasons for no credit being displayed in your Form 26AS can be:Deductor/collector has not filed his TDS/TCS statement;You have not provided PAN to the deductor/collector;You have provided incorrect PAN to the deductor/collector;The deductor/collector has made an error in quoting your PAN in the TDS/TCS return;The deductor/collector has not quoted your PAN;The details of challan against which your TDS/TCS was deposited was wrongly quoted in the statement by the deductor or wrongly quoted in the challan details uploaded by the bank.To rectify these errors you may request the deductor:to file a TDS/TCS statement if it has not been filed;to rectify the PAN using a PAN correction statement in the TDS/TCS statement that has been already uploaded if it has made an error in the PAN quoted;to furnish a correction statement if the deductor had filed a TDS/TCS statement and had inadvertently missed providing your details or you had not given your PAN to him before he filed the TDS/TCS return;to furnish a correction statement if the deductor had filed a TDS/TCS statement which had mistake in the challan details;to take up with the bank to rectify any mistake in the amount in the challan details uploaded by the bank.
363,is there any special benefit available under the income-tax law to senior citizens?,"Yes, the Income-tax Law very well takes care of the senior citizens of the nation by offering them several tax benefits.In this part you can gain knowledge of various benefits offered by the Income-tax Law to senior citizens."
364,"error code 14:""assessee is entering negative amount in gross profit or net profit at serial number 51b and /or 51d. of part b of profit & loss account""","In case where regular books of accounts are not to be maintained, assessee can furnish the data in serial number 51 of Part B of Profit & Loss Account (""No Account Case""). However, all the rows i.e 51a to 51d needs to be filled in.If negative amount derived in Net profit at Serial number 51 d, assessee has get his books audited."
365,"as an agriculturist, am i required to maintain any proof of earnings and expenditures incurred?","Even if you have only agricultural income, you are advised to maintain some proof of your agricultural earnings/expenses."
366,"error code 19:""where domestic flag is null""",Description:A company Assessee has to mention whether it is a domestic or non-domestic company in the return of income in the new xml which will be filed in response to this communication.
367,"i am getting error while filing rectification u/s 154, ""rectification application already submitted for this assessment year."" can i file another rectification request?","No. You can file another Rectification ONLY once the previous one is processed in CPC. You will get an Order u/s 154 once the Rectification is processed. To view the status of your e-Filed Rectification, LOGIN and GO TO 'My Account' 'Rectification status'."
368,what documents will serve as proof of date of birth in case of individual applicants?,"Copy of any of the following document will serve as proof of date of birth in case of individual applicants being Indian citizens (including those located outside India) :Birth Certificate issued by the Municipal Authority or any office authorized to issue Birth and Death Certificate by the Registrar of Birth and Death or the Indian Consulate as defined in clause (d) of sub-section (1) of session 2 of the Citizenship Act, 1955 (57 of 1955); orPension payment order; orMarriage certificate issued by Registrar of Marriages; orMatriculation Certificate; orPassport; orDriving License; orDomicile Certificate issued by the Government; orAffidavit sworn before a magistrate stating the date of birth"
369,what are other formalities to be done after i print itr-v?,Please refer to ITR-V Do's and Don'ts as available in the Help section.
370,what is xml?,"XML stands for Extensible Markup Language. It is a general purpose markup language designed especially for Web documents. XML is a way of describing data and it allows designers to create their own customized tags, enabling the definition, transmission, validation, and interpretation of data between applications and between organizations. Any Excel/Java Utility which creates an e-return XML will be a file with an extension .xml. This is the file that must be uploaded to the ITD e-filing website."
371,assessee is not able to call on toll free number from abroad?,"If assessee cannot connect to the Toll free number, you can call on +91- 80- 22546500."
372,"if income from any source is exempt, then can loss from such source be adjusted against any other taxable income?","If income from a particular source is exempt from tax, then loss from such source cannot be set off against any other income which is chargeable to tax.E.g.,Agricultural income is exempt from tax, hence, if the taxpayer incurs loss from agricultural activity, then such loss cannot be adjusted against any other taxable income."
373,"if a person adopts the presumptive taxation scheme of section 44ad, then is he required to maintain books of account as per section 44aa?","Section 44AAdeals with provisions relating to maintenance of books of account by a person engaged in business/profession. Thus, a person engaged in business/profession has to maintain books of account of his business/profession according to the provisions ofsection 44AA.In case of a person engaged in a business and opting for the presumptive taxation scheme ofsection 44AD, the provisions ofsection 44AA  relating to maintenance of books of account will not apply. In other words, if a person adopts the provisions ofsection 44ADand declares income @ 8% of the turnover, then he is not requiredto maintain the books of account as provided undersection 44AAin respect of business covered under the presumptive taxation scheme ofsection 44AD."
374,why capital gains are classified as short-term and long-term?,"The taxability of capital gain depends on the nature of gain, i.e. whether short-term or long-term. Hence to determine the taxability, capital gains are classified into short-term capital gain and long-term capital gain. In other words, the tax rates for long-term capital gain and short-term capital gain are different. Similarly, computation provisions are different for long-term capital gains and short-term capital gains."
375,what is the manner of computation of taxable business income in case of a person adopting the presumptive taxation scheme of section 44ad?,"In case of a person adopting the provisions ofsection 44AD, income will be computed on presumptive basis,i.e.,@ 8% of the turnover or gross receipts of the eligible business for the year.In other words, in case of a person adopting the provisions ofsection 44AD, income will not be computed in normal manner as discussed in previous FAQ (i.e.,TurnoverlessExpense) but will be computed @ 8% of the turnover.Income at higher rate,i.e.,higher than 8% can be declared if the actual income is higher than 8%."
376,can a chartered accountant (ca) file income tax forms like audit forms on behalf of the taxpayer?,Yes.
377,who can use itr  7?,"Form ITR  7 can be used by persons including companies who are required to furnish return undersection 139(4A)orsection 139(4B) orsection 139(4C)orsection 139(4D)orsection 139(4E) orsection 139(4f)(i.e., trusts, political party, institutions, colleges, investment fund, etc.)."
378,is the residential status of a person relevant for determining the taxability of the income in his hands?,"Yes, the residential status of a person earning income is very much relevant for determining the taxability of such income in his hands.Taxability of any income in the hands of a person depends on the following two things :(1)  Residential status of the person as per the Income-tax Law; and(2)  Nature of income earned by him.Hence, residential status plays a vital role in determining the taxability of the income."
379,what to do if tax is deducted but the ultimate tax liability of the payee is nil or lower than the amount of tds?,"In such a case, the payee can claim the refund of entire/excess amount of TDS (as the case may be) by filing the return of income."
380,can interest paid on loans taken from friends and relatives be claimed as deduction while calculating house property income?,"Yes, if the loan is taken for purchase, construction, repair, renewal or reconstruction of the house. If the loan is taken for personal or other purposes then the interest on such loan cannot be claimed as deduction."
381,if my pan card is lost then what to do?,"If the PAN card is lost then you can apply for duplicate PAN card by submitting the Form for ""Request for New PAN Card or/ and Changes or Correction in PAN Data"" and a copy of FIR may be submitted along with the form.If the PAN card is lost and you don't remember your PAN, then in such a case, you can know you PAN by using the facility of ""Know Your PAN"" provided by the Income Tax Department. This facility can be availed of from the website of Income Tax Department - www.incometaxindia.gov.inYou can know your PAN online by providing the core details like Name, Father's Name and Date of Birth.After knowing the PAN you can apply for duplicate PAN card by submitting the ""Request For New PAN Card Or/ And Changes Or Correction in PAN Data""."
382,"however, the provisions of section 206aa shall not apply to a non-resident, not being a company, or to a foreign company, in respect of",i)payment of interest on long-term bonds as referred to in section 194LC; andii)any other payment subject to such conditions as may be prescribed.
383,can an online application be made for allotment of tan?,Yes. The application can be made online through https://www.tin-nsdl.com
384,i have 5 separate let out properties. should i calculate the house property income separately for each individual property or by clubbing all the rental receipts in one calculation?,The calculation will have to be made separately for each of the properties.
385,i checked the status of my it return and it is displayed as 'refund returned'. how can i apply for it again?,"LOGIN and GO TO 'My Account' 'Refund Re-issue request'. Select the mode of re- receiving refund- ECS or Cheque, Provide Bank Account number (if changed) and Provide Address details."
386,"if the aggregate value of gift received during the year by an individual or huf exceeds rs. 50,000, whether total amount of gift will be charged to tax or only the amount in excess of rs. 50,000 will be charged to tax?","Sum of money received without consideration by an individual or HUF is charged to tax if the aggregate value of such sum received during the year exceeds Rs. 50,000. Once the aggregate value of monetary gift received during the year exceeds Rs. 50,000, then the aggregate value of gift received during the year will be charged to tax."
387,what is current account transaction?,"As defined inSection 2(j) of the FEMA, ""current account transaction"" means a transaction other than a capital account transaction and without prejudice to the generality of the foregoing such transaction includes :Payments due in connection with foreign trade, other current business, services and short-term banking and credit facilities in the ordinary course of business,Payments due as interest on loans and as net income from investments,Remittances for living expenses of parents, spouse and children residing abroad, andExpenses in connection with foreign travel, education and medical care of parents, spouse and children.In terms ofsection 5of the FEMA, Any person may sell or draw foreign exchange to or from an authorized person if such sale or drawl is a current account transaction provided that Central Government may, in public interest and in consultation with the Reserve Bank, impose such reasonable restrictions for current account transactions as may be prescribed. ."
388,should government deductors apply for tan?,Yes
389,which incomes are deemed to be received in india?,Following incomes are treated as incomes deemed to be received in India:Interest credited to recognised provident fund account of an employee in excess of 9.5% per annum.Employer's contribution to recognised provident fund in excess of 12% of the salary of the employee.Transferred balance in case of reorganisation of unrecognised provident fund.Contribution by the Central Government or other employer to the account of the employee in case of notified pension scheme refered to insection 80CCD.
390,what is assessment under section 143(3)?,"This is a detailed assessment and is referred to as scrutiny assessment. At this stage, a detailed scrutiny of the return of income will be carried out. The scrutiny is carried out to confirm the correctness and genuineness of various claims, deductions, etc., made by the taxpayer in the return of income."
391,what precautions should be taken while filing the return of income?,"Following is the list of few important steps/points/precautions to be kept in mind while filing the return of income:The first and foremost precaution is to file the return of income on or before the due date. Taxpayers should avoid the practice of filing belated return. Following are the consequences of delay in filing the return of income :Loss (other than house property loss) cannot be carried forward.Levy of interest undersection 234A.Penalty of Rs. 5,000 undersection 271Fcan be levied.Exemptions/deductions undersection 10A,section 10B,80-IA,80-IAB,80-IB,80-IC,80-IDand80-IEare not available.Belated return cannot be revised undersection 139(5). However, w.e.f. 01-04-2017, income-tax return for the Assessment Year 2017-18 and onwards filed undersection 139(1)orsection 139(4)[belated return can also be revised.Taxpayer should download Form 26AS and should confirm actual TDS/TCS/Tax paid. If any discrepancy is observed then suitable action should be taken to reconcile it.Compile and carefully study the documents to be used while filing the return of income like bank statement/passbook, interest certificate, investment proofs for which deductions is to be claimed, books of account and balance sheet and P/L A/c (if applicable), etc. No documents are to be attached along with the return of income.The taxpayer should identify the correct return form applicable in his case.Carefully provide all the information in the return form.Confirm the calculation of total income, deductions (if any), interest (if any), tax liability/refund, etc. If any tax is payable as per the return of income, then the same should be paid before filing the return of income, otherwise return would be treated as defective return.Ensure that other details like PAN, address, e-mail address, bank account details, etc., are correct.After filling all the details in the return of income and after confirmation of all the details, one can proceed with filing the return of income.In case return is filed electronically without digital signature and without electronic verification code do not forget to post the acknowledgement of filing the return of income at CPC Bangalore (as discussed earlier).For details on e-filing please logon towww.incometaxindiaefiling.gov.in"
392,what documents and information have to be submitted along with the pan application in form 49a/49aa?,"The documents required to be submitted with the PAN application are specified in Rule 114 of the Income-tax Rules. The details of the documents required are also provided in the application form. Individual applicants have to provide document pertaining to proof of identity, proof of address and proof of date of birth. The name of the applicant as mentioned in application form and the name appearing in the documents submitted along with the application should match exactly.Individual applicants should affix two recent colour photographs with white background (size 3.5 cm x 2.5 cm) in the space provided on the form. The photographs should not be stapled or clipped to the form. The clarity of image on PAN card will depend on the quality and clarity of photograph affixed on the form."
393,what are the provisions framed under the income-tax law in relation to carry forward and set off of business loss other than loss from speculative business?,"If loss of any business/profession (other than speculative business) cannot be fully adjusted in the year in which it is incurred, then the unadjusted loss can be carried forward for making adjustment in the next year. In the subsequent year(s) such loss can be adjusted only against income charged to tax under the head ""Profits and gains of business or profession"".Loss under the head ""Profits and gains of business or profession"" can be carried forward only if the return of income/loss of the year in which loss is incurred is furnished on or before the due date of furnishing the return, as prescribed undersection 139(1).Such loss can be carried forward for eight years immediately succeeding the year in which the loss is incurred.Above provisions are not applicable in case of unabsorbed depreciation (provisions relating to unabsorbed depreciation are discussed later).Loss from business specified undersection 35AD cannot be set off against any other income except income from specified business (section 35ADis applicable in respect of certain specified businesses like setting up a cold chain facility, setting up and operating warehousing facility for storage of agricultural produce, developing and building a housing projects, etc.). Such loss can be carried forward for adjustment against income from specified business for any number of years.Loss from Specified business undersection 35AD cannot be carried forward unless it has been determined in pursuance of return filed in accordance with the provisions of Section 139(3).Loss from the business of owning and maintaining race horses cannot be set off against any income other than income from the business of owning and maintaining race horses. Such loss can be carried forward only for a period of 4 years."
394,"if a person adopts the presumptive taxation scheme of section 44ad, then is he liable to pay advance tax in respect of income from business covered under section 44ad?","Any person opting for the presumptive taxation scheme undersection 44ADis liable to pay whole amount of advance tax on or before 15th March of the previous year. If he fails to pay the advance tax by 15th march of previous year, he shall be liable to pay interest as persection 234C.Note: Any amount paid by way of advance tax on or before 31st day of March shall also be treated as advance tax paid during the financial year ending on that day."
395,what is the fee for filing application for tan?,Currently the fee for filing the TAN application is Rs.55/- + service tax as applicable (the application fees may change from time to time).
396,where a notice under section 142(1)/ 143(2)/ 148/ 153a/ 153c of the income-tax act has been issued to a person for an assessment year will he be ineligible from making a declaration under the scheme?,The person will only be ineligible from declaration for those assessment years for which a notice under section 142(1)/143(2)/148/153A/153C is issued and the proceeding is pending before the Assessing Officer. He is free to declare undisclosed income for other years for which no notice under above referred sections has been issued.
397,am i required to keep a copy of the return filed as proof and for how long?,"Yes, since legal proceedings under the Income-tax Act can be initiated up to four or six years (as the case may be) prior to the current financial year, you must maintain such documents at least for this period. However, in certain cases the proceedings can be initiated even after 6 years, hence, it is advised to preserve the copy of return as long as possible. Further, after introduction of the e-filing facility, it is very easy and simple to maintain the copy of return of income."
398,what are the system requirements to download and use the excel/java utility?,"The minimum system requirements needed to download and use the Return Preparation Software are: PC with 128 MB RAM, P-III processor, MS Excel, Internet connection, Internet Browser, at least 25 MB free hard disk space,, Adobe Acrobat Reader, and Windows Operating system (Win 2000 or higher version), Java Run-time Environment Version 1.6 (Beta) or above for using DSC."
399,is rental income from sub-letting chargeable to tax under the head income from house property?,"Rental income in the hands of owner is charged to tax under the head Income from house property. Rental income of a person other than the owner cannot be charged to tax under the head Income from house property. Hence, rental income received by a tenant from sub-letting cannot be charged to tax under the head Income from house property.  Such income is taxable under the head Income from other sources or profits and gains from business or profession, as the case may be."
400,"under which conditions, assessee needs to contact cpc bangalore?","Assessee needs to contact CPC for Processing related matters of Original/ Revised Income Tax Return OR Rectification, Refund/Demand OR Intimation related matters."
